{
  "$schema": "urn:omarchy:ultimate:product-contracts:applications-v0",
  "schemaVersion": "v0",
  "contractStatus": "provisional-v0",
  "normalization": {
    "joinOrder": ["explicit packaged identity alias", "desktop entry id", "StartupWMClass or Wayland app id", "launch activation token", "notification and installed-record identity"],
    "desktopIdRule": "Preserve the exact desktop-file id for launch and store a separately normalized comparison key; never replace an explicit alias with substring matching.",
    "windowIdRule": "Map exact declared compositor ids to one application contract id and quarantine ambiguous or previously unseen ids instead of guessing.",
    "ambiguityRule": "One observed id matching more than one application is an error; no pin, badge, jump list, recent item, notification, or task may attach until resolved."
  },
  "applications": [
    { "id": "app.omarchy.basecamp", "contractPrincipalId": "principal.app.basecamp", "currentPrincipalId": "principal.desktop-app.dynamic", "processId": "process.desktop-app.dynamic", "displayName": "Basecamp", "firstParty": true, "availability": "legacy-unjoined", "desktopEntryPath": "applications/Basecamp.desktop", "desktopIds": ["Basecamp"], "compositorMatchers": [], "taskbar": { "visibility": "dynamic", "shippedPin": false, "identityJoin": "heuristic" }, "singleInstance": { "mode": "application-defined", "activation": "desktop-entry", "state": "legacy" }, "deepLinks": [], "humanRoutes": ["route.surface.omarchy.ultimate-start", "route.surface.omarchy.menu", "route.surface.omarchy.ultimate-run"], "evidencePaths": ["applications/Basecamp.desktop", "shell/services/AppLibrary.qml"], "debtIds": ["debt.identity.heuristic-window-join"] },
    { "id": "app.omarchy.discord", "contractPrincipalId": "principal.app.discord", "currentPrincipalId": "principal.desktop-app.dynamic", "processId": "process.desktop-app.dynamic", "displayName": "Discord", "firstParty": true, "availability": "legacy-unjoined", "desktopEntryPath": "applications/Discord.desktop", "desktopIds": ["Discord"], "compositorMatchers": [], "taskbar": { "visibility": "dynamic", "shippedPin": false, "identityJoin": "heuristic" }, "singleInstance": { "mode": "application-defined", "activation": "desktop-entry", "state": "legacy" }, "deepLinks": [], "humanRoutes": ["route.surface.omarchy.ultimate-start", "route.surface.omarchy.menu", "route.surface.omarchy.ultimate-run"], "evidencePaths": ["applications/Discord.desktop", "shell/services/AppLibrary.qml"], "debtIds": ["debt.identity.heuristic-window-join"] },
    { "id": "app.omarchy.disk-usage", "contractPrincipalId": "principal.app.disk-usage", "currentPrincipalId": "principal.desktop-app.dynamic", "processId": "process.desktop-app.dynamic", "displayName": "Disk Usage", "firstParty": true, "availability": "legacy-unjoined", "desktopEntryPath": "applications/Disk Usage.desktop", "desktopIds": ["Disk Usage"], "compositorMatchers": ["TUI.float"], "taskbar": { "visibility": "dynamic", "shippedPin": false, "identityJoin": "heuristic" }, "singleInstance": { "mode": "allow-many", "activation": "desktop-entry", "state": "legacy" }, "deepLinks": [], "humanRoutes": ["route.surface.omarchy.ultimate-start", "route.surface.omarchy.menu", "route.surface.omarchy.ultimate-run"], "evidencePaths": ["applications/Disk Usage.desktop", "shell/services/AppLibrary.qml"], "debtIds": ["debt.identity.heuristic-window-join"] },
    { "id": "app.omarchy.docker", "contractPrincipalId": "principal.app.docker", "currentPrincipalId": "principal.desktop-app.dynamic", "processId": "process.desktop-app.dynamic", "displayName": "Docker", "firstParty": true, "availability": "legacy-unjoined", "desktopEntryPath": "applications/Docker.desktop", "desktopIds": ["Docker"], "compositorMatchers": ["TUI.tile"], "taskbar": { "visibility": "dynamic", "shippedPin": false, "identityJoin": "heuristic" }, "singleInstance": { "mode": "allow-many", "activation": "desktop-entry", "state": "legacy" }, "deepLinks": [], "humanRoutes": ["route.surface.omarchy.ultimate-start", "route.surface.omarchy.menu", "route.surface.omarchy.ultimate-run"], "evidencePaths": ["applications/Docker.desktop", "shell/services/AppLibrary.qml"], "debtIds": ["debt.identity.heuristic-window-join"] },
    { "id": "app.omarchy.foot", "contractPrincipalId": "principal.app.foot", "currentPrincipalId": "principal.desktop-app.dynamic", "processId": "process.desktop-app.dynamic", "displayName": "Foot", "firstParty": true, "availability": "legacy-unjoined", "desktopEntryPath": "applications/foot.desktop", "desktopIds": ["foot"], "compositorMatchers": ["foot"], "taskbar": { "visibility": "dynamic", "shippedPin": false, "identityJoin": "heuristic" }, "singleInstance": { "mode": "allow-many", "activation": "desktop-entry", "state": "legacy" }, "deepLinks": [], "humanRoutes": ["route.surface.omarchy.ultimate-start", "route.surface.omarchy.menu", "route.surface.omarchy.ultimate-run"], "evidencePaths": ["applications/foot.desktop", "shell/services/AppLibrary.qml"], "debtIds": ["debt.identity.heuristic-window-join"] },
    { "id": "app.omarchy.google-contacts", "contractPrincipalId": "principal.app.google-contacts", "currentPrincipalId": "principal.desktop-app.dynamic", "processId": "process.desktop-app.dynamic", "displayName": "Google Contacts", "firstParty": true, "availability": "legacy-unjoined", "desktopEntryPath": "applications/Google Contacts.desktop", "desktopIds": ["Google Contacts"], "compositorMatchers": [], "taskbar": { "visibility": "dynamic", "shippedPin": false, "identityJoin": "heuristic" }, "singleInstance": { "mode": "application-defined", "activation": "desktop-entry", "state": "legacy" }, "deepLinks": [], "humanRoutes": ["route.surface.omarchy.ultimate-start", "route.surface.omarchy.menu", "route.surface.omarchy.ultimate-run"], "evidencePaths": ["applications/Google Contacts.desktop", "shell/services/AppLibrary.qml"], "debtIds": ["debt.identity.heuristic-window-join"] },
    { "id": "app.omarchy.google-maps", "contractPrincipalId": "principal.app.google-maps", "currentPrincipalId": "principal.desktop-app.dynamic", "processId": "process.desktop-app.dynamic", "displayName": "Google Maps", "firstParty": true, "availability": "legacy-unjoined", "desktopEntryPath": "applications/Google Maps.desktop", "desktopIds": ["Google Maps"], "compositorMatchers": [], "taskbar": { "visibility": "dynamic", "shippedPin": false, "identityJoin": "heuristic" }, "singleInstance": { "mode": "application-defined", "activation": "desktop-entry", "state": "legacy" }, "deepLinks": [], "humanRoutes": ["route.surface.omarchy.ultimate-start", "route.surface.omarchy.menu", "route.surface.omarchy.ultimate-run"], "evidencePaths": ["applications/Google Maps.desktop", "shell/services/AppLibrary.qml"], "debtIds": ["debt.identity.heuristic-window-join"] },
    { "id": "app.omarchy.google-messages", "contractPrincipalId": "principal.app.google-messages", "currentPrincipalId": "principal.desktop-app.dynamic", "processId": "process.desktop-app.dynamic", "displayName": "Google Messages", "firstParty": true, "availability": "legacy-unjoined", "desktopEntryPath": "applications/Google Messages.desktop", "desktopIds": ["Google Messages"], "compositorMatchers": [], "taskbar": { "visibility": "dynamic", "shippedPin": false, "identityJoin": "heuristic" }, "singleInstance": { "mode": "application-defined", "activation": "desktop-entry", "state": "legacy" }, "deepLinks": [], "humanRoutes": ["route.surface.omarchy.ultimate-start", "route.surface.omarchy.menu", "route.surface.omarchy.ultimate-run"], "evidencePaths": ["applications/Google Messages.desktop", "shell/services/AppLibrary.qml"], "debtIds": ["debt.identity.heuristic-window-join"] },
    { "id": "app.omarchy.google-photos", "contractPrincipalId": "principal.app.google-photos", "currentPrincipalId": "principal.desktop-app.dynamic", "processId": "process.desktop-app.dynamic", "displayName": "Google Photos", "firstParty": true, "availability": "legacy-unjoined", "desktopEntryPath": "applications/Google Photos.desktop", "desktopIds": ["Google Photos"], "compositorMatchers": [], "taskbar": { "visibility": "dynamic", "shippedPin": false, "identityJoin": "heuristic" }, "singleInstance": { "mode": "application-defined", "activation": "desktop-entry", "state": "legacy" }, "deepLinks": [], "humanRoutes": ["route.surface.omarchy.ultimate-start", "route.surface.omarchy.menu", "route.surface.omarchy.ultimate-run"], "evidencePaths": ["applications/Google Photos.desktop", "shell/services/AppLibrary.qml"], "debtIds": ["debt.identity.heuristic-window-join"] },
    { "id": "app.omarchy.hey", "contractPrincipalId": "principal.app.hey", "currentPrincipalId": "principal.desktop-app.dynamic", "processId": "process.desktop-app.dynamic", "displayName": "HEY", "firstParty": true, "availability": "legacy-unjoined", "desktopEntryPath": "applications/HEY.desktop", "desktopIds": ["HEY"], "compositorMatchers": [], "taskbar": { "visibility": "dynamic", "shippedPin": false, "identityJoin": "heuristic" }, "singleInstance": { "mode": "application-defined", "activation": "desktop-entry", "state": "legacy" }, "deepLinks": [], "humanRoutes": ["route.surface.omarchy.ultimate-start", "route.surface.omarchy.menu", "route.surface.omarchy.ultimate-run"], "evidencePaths": ["applications/HEY.desktop", "shell/services/AppLibrary.qml"], "debtIds": ["debt.identity.heuristic-window-join"] },